table_id,suggested_title,source_artifacts,tcc_section,safe_caption,unsafe_caption,allowed_interpretation,forbidden_interpretation,include_in_main_text,include_in_appendix
TAB_v2aj_000,Review-only candidate package state,datasets/protocolo_c/v2ah_candidate_reference_review_queue.csv,results,Candidates retained as review-only packages.,operational results table,Describe review queue status.,Do not infer accuracy or validation.,true,true
TAB_v2aj_001,Promotion blockers by package,datasets/protocolo_c/v2ai_safe_promotion_blockers.csv,limitations,All packages remain blocked from promotion.,validated event blockers resolved,Explain why no promotion occurs.,Do not claim blockers are solved.,true,true
TAB_v2aj_002,Safe and unsafe claim matrix,datasets/protocolo_c/v2aj_tcc_protocol_c_claims_matrix.csv,methods,Claims are explicitly separated.,free-form claims,Use as writing guardrail.,Do not bypass unsafe wording.,true,true
TAB_v2aj_003,Human review assignment package,datasets/protocolo_c/v2ai_review_assignment_registry.csv,future_work,Reviewer slots prepared for future review.,completed review results,Explain future review structure.,Do not imply review completed.,false,true
TAB_v2aj_004,Uncertainty registry,datasets/protocolo_c/v2ai_uncertainty_registry.csv,discussion,Uncertainties remain unresolved.,uncertainties solved,Discuss dominant blockers.,Do not auto-resolve uncertainty.,true,true
TAB_v2aj_005,Structured review guide,datasets/protocolo_c/v2aj_review_guide_registry.csv,appendix,Guide defines future review questions.,review outcome table,Place detailed guide in appendix.,Do not treat as decision.,false,true
TAB_v2aj_006,Safe next actions,datasets/protocolo_c/v2aj_next_actions_registry.csv,future_work,Next actions remain non-operational.,model training plan,Report safe next steps.,Do not recommend training or overlay.,true,true
