evidence_item,evidence_axis,evidence_class,supports_occurrence,supports_spatial_anchor,supports_geometry_candidate,supports_temporal_gap_resolution,context_only,promotion_blocker,limitation,can_create_ground_truth,can_create_patch_truth,can_create_label,can_create_negative,can_train_model,charter_product_is_not_ground_truth,published_map_is_not_confirmed_vector,landslide_scar_is_not_flood_extent,olinda_product_is_not_recife_evidence,copernicus_not_found_is_not_positive_evidence,regional_proxy_does_not_replace_a301,raw_data_versioned
Charter 758 Recife product,OCCURRENCE,OFFICIAL_DISASTER_MAPPING_PRODUCT,true,true,true,false,false,VECTOR_CRS_AND_PRODUCT_ACCESS_NOT_CONFIRMED,"Confirms an official mapping product, not final truth.",false,false,false,false,false,true,true,true,true,true,true,false
Charter 758 Recife product,SPATIALITY,OFFICIAL_DISASTER_MAPPING_PRODUCT,true,true,true,false,false,VECTOR_CRS_AND_PRODUCT_ACCESS_NOT_CONFIRMED,Published map geometry is review evidence; vector and feature semantics remain unconfirmed.,false,false,false,false,false,true,true,true,true,true,true,false
Charter 758 Recife product,HAZARD_SEMANTICS,MULTIHAZARD_PRODUCT,true,false,false,false,true,LANDSLIDE_FLOOD_FEATURES_REQUIRE_SEPARATION,Landslide scar must not be interpreted as flood extent.,false,false,false,false,false,true,true,true,true,true,true,false
Charter 758 Olinda products,SPATIALITY,OUT_OF_RECIFE_SCOPE_PRODUCT,false,false,false,false,true,OLINDA_NOT_TRANSFERABLE_TO_RECIFE,Olinda products dated 2022-06-03 are not Recife evidence.,false,false,false,false,false,true,true,true,true,true,true,false
Copernicus EMS Recife May 2022 search,SOURCE_SEARCH,NOT_FOUND_SEARCH_RESULT,false,false,false,false,true,NOT_FOUND_IS_NOT_POSITIVE_EVIDENCE,Search result cannot support occurrence or geometry.,false,false,false,false,false,true,true,true,true,true,true,false
INMET regional proxy stations,TEMPORALITY,REGIONAL_PROXY,false,false,false,false,true,LOCAL_SPATIAL_REPRESENTATIVENESS_NOT_PROVEN,A357/A328/A320 do not replace A301.,false,false,false,false,false,true,true,true,true,true,true,false
