task_id,blocker_type,required_action,expected_artifact,priority,blocks_gate,resolved_by_file_or_metadata,can_create_ground_truth,can_create_patch_truth,can_create_label,can_create_negative,can_train_model,charter_vector_is_not_final_ground_truth,charter_geometry_requires_human_review,temporal_series_is_not_spatial_geometry,rainfall_is_not_flood_extent,landslide_geometry_is_not_flood_extent,crs_missing_blocks_geometry_promotion,raw_data_versioned
TASK_v2bi_001,CHARTER_VECTOR_CRS_ACCESS,Download or request the Recife Charter product vector and CRS.,CHARTER_VECTOR_WITH_CRS_METADATA,P0,C4_CANDIDATE_GEOMETRY,false,false,false,false,false,false,true,true,true,true,true,true,false
TASK_v2bi_002,APAC_CEMADEN_SERIES_ACCESS,Download APAC/Cemaden Recife May 2022 series into manual_temporal.,PARSEABLE_LOCAL_TEMPORAL_SERIES,P0,C1_TEMPORALITY|C2_VALID_SERIES_OR_STATION,false,false,false,false,false,false,true,true,true,true,true,true,false
TASK_v2bi_003,FEATURE_TYPE_CONFIRMATION,Confirm mapped Charter feature semantics.,FEATURE_TYPE_REVIEW_RECORD,P1,C4_CANDIDATE_GEOMETRY|C5_HUMAN_REVIEW,false,false,false,false,false,false,true,true,true,true,true,true,false
TASK_v2bi_004,LICENSE_TERMS_CONFIRMATION,Confirm Charter product license and redistribution terms.,LICENSE_TERMS_RECORD,P1,C4_CANDIDATE_GEOMETRY,false,false,false,false,false,false,true,true,true,true,true,true,false
TASK_v2bi_005,HUMAN_REVIEW_REQUIRED,Human-review any validated Charter geometry.,HUMAN_REVIEW_DECISION,P1,C5_HUMAN_REVIEW|C6_CANDIDATE_REFERENCE,false,false,false,false,false,false,true,true,true,true,true,true,false
