policy_item,old_interpretation,refined_interpretation,applies_to_region,effect_on_gate,still_blocks_operational_label,can_support_candidate_reference,note,can_create_operational_label,can_create_negative,can_train_model,cross_region_reapplication_is_not_training,temporal_reference_is_not_label,visual_review_reference_is_not_label,contextual_reference_is_not_label,regional_proxy_is_not_local_station,sentinel_preview_is_not_event_truth,dino_signal_is_not_truth,patch_boundary_is_not_event_geometry,no_supervised_training_target_created,raw_data_versioned
PUBLIC_SOURCE_LICENSE,License/redistribution/confirmation as blocker,"Provenance metadata, not a blocker",ALL,C0_PROVENANCE,false,true,Public official sources are valid evidence with recorded provenance.,false,false,false,true,true,true,true,true,true,true,true,true,false
MANUAL_HUMAN_REVIEW,Separate mandatory manual review step,Automated protocol validation (fail-closed),ALL,C5_PROTOCOL_VALIDATION,false,true,Coherent dated/located/typed evidence is adjudicated automatically.,false,false,false,true,true,true,true,true,true,true,true,true,false
RASTER_CARTOGRAPHIC_EVIDENCE,Raster dismissed as not-evidence,Raster can sustain candidate reference,RECIFE,C4_CANDIDATE_GEOMETRY,false,true,Inherited from Recife: official raster supports candidate reference.,false,false,false,true,true,true,true,true,true,true,true,true,false
VECTOR_CRS,Vector/CRS absence as general blocker,Technical limitation for vector geometry/overlay,ALL,C4_CANDIDATE_GEOMETRY,true,true,"Blocks vector overlay only, not the reference.",false,false,false,true,true,true,true,true,true,true,true,true,false
SENTINEL_VISUAL,Sentinel preview treated as truth,"Visual review support, not truth",CURITIBA,C4_CANDIDATE_GEOMETRY,true,true,"Sentinel preview is review context, not event truth.",false,false,false,true,true,true,true,true,true,true,true,true,false
DINO_SIGNAL,DINO treated as truth/label,"Structural review signal, not truth",CURITIBA,C5_PROTOCOL_VALIDATION,true,true,"DINO reinforces review, never creates a label.",false,false,false,true,true,true,true,true,true,true,true,true,false
REGIONAL_PROXY,Regional proxy treated as local station,"Sustains regional/contextual evidence, not local station",PETROPOLIS,C2_VALID_SERIES_OR_STATION,true,true,A610 proxy supports context; it is not a local station.,false,false,false,true,true,true,true,true,true,true,true,true,false
LOCAL_STRONG_SERIES,Local series under-used,Strong local series sustains a temporal reference,CURITIBA,C1_TEMPORALITY,false,true,A807 LOCAL strong series supports a temporal seed/reference.,false,false,false,true,true,true,true,true,true,true,true,true,false
INSTRUMENT_GAP,Instrumental absence as negative,"Documented instrument gap, not absence of event",ALL,C1_TEMPORALITY,true,false,"Empty local station is an instrument gap, never a negative.",false,false,false,true,true,true,true,true,true,true,true,true,false
