observed_event_id,region,event_name,event_type,date_start,date_end,temporal_precision_level,spatial_precision_level,primary_source_type,primary_source_name,primary_source_url,secondary_source_type,secondary_source_name,secondary_source_url,observed_event_confirmed,source_traceable,temporal_alignment_status,spatial_alignment_triage_status,g1_event_confirmation,g2_source_availability,g3_temporal_alignment,g4_spatial_alignment_triage,priority_level,ground_reference_candidate_status,operational_ground_truth_status,protocol_b_status,multimodal_status,dino_usage_status,can_advance_to_source_review,can_advance_to_patch_linking,can_be_used_as_training_label,can_reopen_protocol_b,requires_review_gate,missing_evidence,notes
REC_2022_05_24_30,Recife,Chuvas extremas e alagamentos do fim de maio de 2022,chuva_extrema_alagamento,2022-05-24,2022-05-30,MULTI_DAY_WINDOW,NEIGHBORHOOD,OFFICIAL_MUNICIPAL,Prefeitura do Recife,https://www2.recife.pe.gov.br/noticias/28/05/2022/prefeitura-do-recife-declara-situacao-de-emergencia-e-intensifica-acoes,OFFICIAL_MUNICIPAL,Prefeitura do Recife; APAC; CEMADEN; Copernicus metodologia,https://www2.recife.pe.gov.br/noticias/25/05/2022/em-apenas-48h-recife-registra-quase-80-das-chuvas-previstas-para-todo-o-mes-de;https://www2.recife.pe.gov.br/noticias/30/05/2022/mutirao-de-limpeza-nos-locais-mais-atingidos-pelas-chuvas-segue-avancando-no,true,true,CLOSED,CLOSED,CLOSED,CLOSED,CLOSED,CLOSED,HIGH,CANDIDATE_FOR_SOURCE_REVIEW,NOT_ESTABLISHED,BLOCKED,HOLD,SUPPORT_ONLY,true,false,false,false,true,decreto completo; boletins Defesa Civil; base de ocorrências críticas; pontos de alagamento; geometria local; revisão supervisora,Evento forte para Recife; G1/G2/G3 fechados documentalmente; sem overlay patch-level ou geometria pública consolidada no repositório
REC_2023_02_05_06,Recife,Chuva extrema e alagamentos de fevereiro de 2023,chuva_extrema_alagamento,2023-02-05,2023-02-06,SHORT_WINDOW,STREET_OR_POINT,OFFICIAL_MUNICIPAL,Prefeitura do Recife,https://www2.recife.pe.gov.br/noticias/06/02/2023/em-12-horas-recife-registra-158-mm-de-chuvas,LOCAL_NEWS,NE10/Jornal local com pontos de alagamento,NOT_ACQUIRED_PUBLIC_REVIEW_REQUIRED,true,true,CLOSED,CLOSED,CLOSED,CLOSED,CLOSED,CLOSED,MEDIUM,CANDIDATE_FOR_SOURCE_REVIEW,NOT_ESTABLISHED,BLOCKED,HOLD,SUPPORT_ONLY,true,false,false,false,true,lista oficial de pontos de alagamento; fonte secundária arquivada; geometria; licença; revisão supervisora,Evento com boa data e fonte municipal; precisa de espacialização oficial para avançar
REC_2024_06_14_16,Recife,Chuvas e alagamentos de junho de 2024,chuva_extrema_alagamento,2024-06-14,2024-06-16,SHORT_WINDOW,NEIGHBORHOOD,OFFICIAL_MUNICIPAL,Prefeitura do Recife,https://www2.recife.pe.gov.br/noticias/16/06/2024/recife-teve-o-maior-volume-de-chuva-em-24h-desde-maio-de-2022,OFFICIAL_MUNICIPAL,Diário Oficial do Município do Recife,https://dome.recife.pe.gov.br/upload_dome/DO_083__18_06_2024-assinado.pdf,true,true,CLOSED,CLOSED,CLOSED,CLOSED,CLOSED,CLOSED,MEDIUM,CANDIDATE_FOR_SOURCE_REVIEW,NOT_ESTABLISHED,BLOCKED,HOLD,SUPPORT_ONLY,true,false,false,false,true,boletins detalhados; pontos de alagamento; licença; georreferenciamento; revisão supervisora,Evento recente com fonte municipal forte; inferência operacional bloqueada sem geometria
PET_2022_02_15,Petrópolis,Desastre hidrometeorológico de 15 de fevereiro de 2022,evento_misto,2022-02-15,2022-02-16,SHORT_WINDOW,TECHNICAL_MAP,TECHNICAL_REPORT,DRM-RJ / NADE / Thalweg,https://www.rj.gov.br/drm/sites/default/files/arquivos_paginas/RL_09.2022.01-MTDLG-PETROPOLIS.pdf,ACADEMIC_PAPER,NHESS / Copernicus Image of the Day,https://nhess.copernicus.org/articles/23/1157/2023/;https://www.copernicus.eu/en/media/image-day-gallery/deadly-landslides-petropolis-brazil,true,true,CLOSED,CLOSED,CLOSED,CLOSED,CLOSED,CLOSED,HIGH,CANDIDATE_FOR_SOURCE_REVIEW,NOT_ESTABLISHED,BLOCKED,HOLD,SUPPORT_ONLY,true,false,false,false,true,separação inundação/deslizamento; shapefiles; polígonos de área afetada; vistorias individuais; licença; revisão supervisora,Evento mais forte para Petrópolis; exige separação rigorosa de fenômenos antes de qualquer uso operacional
PET_2022_03_20_21,Petrópolis,Segundo evento crítico de março de 2022,evento_misto,2022-03-20,2022-03-21,SHORT_WINDOW,TECHNICAL_MAP,TECHNICAL_REPORT,DRM-RJ relatório técnico,https://www.rj.gov.br/drm/sites/default/files/arquivos_paginas/RL_09.2022.01-MTDLG-PETROPOLIS.pdf,TECHNICAL_REPORT,Fontes técnicas complementares pendentes de revisão,NOT_ACQUIRED_PUBLIC_REVIEW_REQUIRED,true,true,CLOSED,CLOSED,CLOSED,CLOSED,CLOSED,CLOSED,HIGH,CANDIDATE_FOR_SOURCE_REVIEW,NOT_ESTABLISHED,BLOCKED,HOLD,SUPPORT_ONLY,true,false,false,false,true,fonte específica do evento; geometria de área afetada; relatório individual; separação de fenômenos; revisão supervisora,Evento candidato forte; dependente de extração cuidadosa do relatório DRM-RJ e fontes complementares
PET_2024_03_21_28,Petrópolis,Chuvas do fim de março de 2024,desastre_hidrometeorologico,2024-03-21,2024-03-28,MULTI_DAY_WINDOW,PARTIAL,OFFICIAL_MUNICIPAL,Prefeitura de Petrópolis,https://www.petropolis.rj.gov.br/pmp/index.php/noticias/item/21454-prefeitura-e-cef-buscam-liberacao-de-fgts-para-moradores-de-areas-atingidas-pelas-chuvas,COPERNICUS_PRODUCT,Copernicus Global Flood Monitoring,https://global-flood.emergency.copernicus.eu/react/news/166-flooding-in-espirito-santo-and-rio-de-janeiro-states-brazil-march-2024/,true,true,CLOSED,PARTIAL,CLOSED,CLOSED,CLOSED,PARTIAL,MEDIUM,CANDIDATE_WITH_PARTIAL_SPATIAL_EVIDENCE,NOT_ESTABLISHED,BLOCKED,HOLD,SUPPORT_ONLY,true,false,false,false,true,geometria local de área afetada; produto Copernicus com detalhe municipal; confirmação de cobertura específica; revisão supervisora,Evento com fonte municipal e produto operacional regional; G4 apenas parcial por cobertura espacial insuficiente para triagem municipal detalhada
CTB_2022_01_15_16,Curitiba,Temporal e alagamentos de janeiro de 2022,chuva_extrema_alagamento,2022-01-15,2022-01-16,SHORT_WINDOW,NEIGHBORHOOD,OFFICIAL_MUNICIPAL,Prefeitura de Curitiba,https://www.curitiba.pr.gov.br/noticias/defesa-civil-alerta-para-mais-chuva-durante-a-madrugada/62283,LOCAL_NEWS,TopView / Banda B,NOT_ACQUIRED_PUBLIC_REVIEW_REQUIRED,true,true,CLOSED,CLOSED,CLOSED,CLOSED,CLOSED,CLOSED,MEDIUM,CANDIDATE_FOR_SOURCE_REVIEW,NOT_ESTABLISHED,BLOCKED,HOLD,SUPPORT_ONLY,true,false,false,false,true,boletins Defesa Civil; pontos georreferenciados; dados pluviométricos Simepar; revisão supervisora,Evento candidato municipal; ainda sem dados espaciais fortes no repositório
CTB_2023_10_28_30,Curitiba,Chuvas muito fortes de outubro de 2023,chuva_extrema_alagamento,2023-10-28,2023-10-30,SHORT_WINDOW,STREET_OR_POINT,OFFICIAL_MUNICIPAL,Prefeitura de Curitiba,https://www.curitiba.pr.gov.br/noticias/prefeitura-de-curitiba-atende-familias-atingidas-pelas-chuvas-por-toda-a-cidade/70975,OFFICIAL_MUNICIPAL,Prefeitura de Curitiba - limpeza pós-evento,https://www.curitiba.pr.gov.br/noticias/equipes-da-prefeitura-de-curitiba-continuam-limpeza-das-ruas-apos-as-chuvas-do-fim-de-semana/70977,true,true,CLOSED,CLOSED,CLOSED,CLOSED,CLOSED,CLOSED,HIGH,CANDIDATE_FOR_SOURCE_REVIEW,NOT_ESTABLISHED,BLOCKED,HOLD,SUPPORT_ONLY,true,false,false,false,true,ocorrências Defesa Civil; geometria Caximba/Cajuru; fotos oficiais arquivadas; dados Simepar; revisão supervisora,Evento mais forte de Curitiba para iniciar ground reference; ainda sem patch-link; Caximba e Cajuru mencionados nas fontes
CTB_2024_02_18_20,Curitiba,Chuvas intensas de fevereiro de 2024,chuva_extrema_alagamento,2024-02-18,2024-02-20,SHORT_WINDOW,NEIGHBORHOOD,OFFICIAL_MUNICIPAL,Prefeitura de Curitiba,https://www.curitiba.pr.gov.br/noticias/prefeitura-de-curitiba-trabalha-para-diminuir-transtornos-causados-pelas-chuvas/72313,LOCAL_NEWS,Banda B / recorrência de alagamentos no Cajuru,NOT_ACQUIRED_PUBLIC_REVIEW_REQUIRED,true,true,CLOSED,CLOSED,CLOSED,CLOSED,CLOSED,CLOSED,MEDIUM,CANDIDATE_FOR_SOURCE_REVIEW,NOT_ESTABLISHED,BLOCKED,HOLD,SUPPORT_ONLY,true,false,false,false,true,fonte secundária arquivada; pontos de alagamento georreferenciados; dados de chuva; revisão supervisora,Evento candidato com boa fonte municipal; precisa de detalhe espacial para avançar
