corpus_id,pipeline_stage,corpus_name,n_patches,regions,region_counts,modality,public_manifest,local_assets_status,qa_status,pixel_reads,embeddings_extracted,embeddings_location,limitations,related_manifest_file
v1fu_sentinel_128,v1fu,Manifest Sentinel entrada DINO,128,Curitiba / Petrópolis / Recife,Curitiba=43 Petrópolis=48 Recife=37,sentinel,manifests/dino_inputs/revp_v1fu_dino_sentinel_input_manifest/,EXISTS,PASS,NO,NO,N/A — scaffold público apenas em v1fw,asset_path_reference é relativo ao workspace local; pixels não lidos no estágio público,dino_sentinel_input_manifest_v1fu.csv
v1fv_preflight,v1fv,Preflight local de assets Sentinel,128,Curitiba / Petrópolis / Recife,Curitiba=43 Petrópolis=48 Recife=37,sentinel,N/A — resultado local-only,EXISTS,PASS,NO,NO,local_runs/dino_asset_preflight/v1fv/ (não versionado),Preflight confirma acessibilidade de path; não lê pixels; resultado depende de workspace local,dino_local_asset_preflight_v1fv.csv
v1fw_scaffold,v1fw,Scaffold de extração de embeddings,128,Curitiba / Petrópolis / Recife,Curitiba=43 Petrópolis=48 Recife=37,sentinel,scripts/dino/revp_v1fw_dino_embedding_extraction_scaffold.py,EXISTS,PASS,NO,NO,N/A — scaffold: plano / schema / QA; sem extração real,Estágio público documenta o plano; extração real executada localmente nos estágios v1fx+,dino_embedding_extraction_plan_v1fw.csv
v1fx_smoke,v1fx,Execução smoke — 5 patches,5,Curitiba / Petrópolis / Recife,Estimado: 1-2 por região,sentinel,N/A — execução local-only,EXISTS,PASS,YES,YES,local_runs/dino_embeddings/v1fx/ (não versionado),Amostra de 5 patches para validar funcionamento do encoder; não representativa; sem inferência regional,N/A
v1fz_balanced,v1fz,Corpus balanceado DINO — 12 patches,12,Curitiba / Petrópolis / Recife,Curitiba=4 Petrópolis=4 Recife=4,sentinel,N/A — corpus local-only,EXISTS,PASS,YES,YES,local_runs/dino_embeddings/v1fz/ (não versionado),"12 patches para diagnósticos estruturais; balanceamento intencional; não representativo de distribuição real dos 59 patches; sem inferência regional, sem label, sem target",N/A
v1ge_expanded,v1ge,Corpus expandido DINO — 12 patches,12,Curitiba / Petrópolis / Recife,Curitiba=4 Petrópolis=4 Recife=4,sentinel,N/A — corpus local-only,EXISTS,PASS,YES,YES,local_runs/dino_embeddings/v1ge/ (não versionado),Corpus expandido com análise GIS (v1gq–v1gt); mesmos 12 patches do v1fz com índice GIS associado; GIS não é ground truth,dino_expanded_embedding_manifest_v1ge.csv
