region,evidence_axis,score,score_reason,supports_reference_status,supports_operational_label,limitation,can_create_operational_label,can_create_negative,can_train_model,cross_region_reapplication_is_not_training,temporal_reference_is_not_label,visual_review_reference_is_not_label,contextual_reference_is_not_label,regional_proxy_is_not_local_station,sentinel_preview_is_not_event_truth,dino_signal_is_not_truth,patch_boundary_is_not_event_geometry,no_supervised_training_target_created,raw_data_versioned
Curitiba,PROVENANCE,1.0,Public official sources with recorded provenance.,true,false,"License is metadata, not a blocker.",false,false,false,true,true,true,true,true,true,true,true,true,false
Curitiba,TEMPORALITY,1.0,Dated precipitation/temporal evidence in the window.,true,false,Temporal evidence is not spatial truth.,false,false,false,true,true,true,true,true,true,true,true,true,false
Curitiba,SPATIAL_CARTOGRAPHIC_EVIDENCE,0.2,Official cartographic product availability.,false,false,Raster is not a vector geometry.,false,false,false,true,true,true,true,true,true,true,true,true,false
Curitiba,VISUAL_REVIEW_CONTEXT,1.0,Sentinel preview / patch link for human visual review.,true,false,Sentinel preview is not event truth.,false,false,false,true,true,true,true,true,true,true,true,true,false
Curitiba,HYDROLOGICAL_CONTEXT,0.0,River-stage hydrological context.,false,false,River stage is not precipitation and not flood extent.,false,false,false,true,true,true,true,true,true,true,true,true,false
Curitiba,DINO_REVIEW_SIGNAL,0.6,"DINO structural signal as a review aid, not truth.",true,false,DINO signal is not truth and is not a label.,false,false,false,true,true,true,true,true,true,true,true,true,false
Curitiba,GEOMETRY_VECTOR_READYNESS,0.2,Vector/CRS readiness for geometry overlay.,false,false,Technical limitation for vector overlay only.,false,false,false,true,true,true,true,true,true,true,true,true,false
Curitiba,MODEL_LABEL_READYNESS,0.0,No operational/binary label or training target created.,false,false,Intentionally not created; C7 blocked.,false,false,false,true,true,true,true,true,true,true,true,true,false
